{
  "camera": {
    "locked": true,
    "view_zh": "固定教学视图（Phase 1 契约 fixture）"
  },
  "canvas": {
    "coordinate_system": "pixel_xy_top_left",
    "height": 180,
    "width": 320
  },
  "case_id": "CHEM-02",
  "fixed_across_sequence_zh": [
    "玻璃皿和镜头",
    "晶体实例身份",
    "溶质总质量定义"
  ],
  "keyframes": [
    {
      "forbidden_zh": [
        "把 Phase 1 fixture 当成完成的科学模拟",
        "让模型改变程序定义的数量、位置或拓扑"
      ],
      "keyframe_id": "keyframe_00",
      "meaning_zh": "透明溶液中没有可见晶体",
      "only_major_change_zh": "透明溶液中没有可见晶体",
      "order": 0,
      "selection_condition_zh": "仅用于契约冒烟：fixture_progress = 0.000000",
      "state_id": "state_00"
    },
    {
      "forbidden_zh": [
        "把 Phase 1 fixture 当成完成的科学模拟",
        "让模型改变程序定义的数量、位置或拓扑"
      ],
      "keyframe_id": "keyframe_01",
      "meaning_zh": "水位下降且浓度上升但未成核",
      "only_major_change_zh": "水位下降且浓度上升但未成核",
      "order": 1,
      "selection_condition_zh": "仅用于契约冒烟：fixture_progress = 0.333333",
      "state_id": "state_01"
    },
    {
      "forbidden_zh": [
        "把 Phase 1 fixture 当成完成的科学模拟",
        "让模型改变程序定义的数量、位置或拓扑"
      ],
      "keyframe_id": "keyframe_02",
      "meaning_zh": "少数带身份的晶核首次出现",
      "only_major_change_zh": "少数带身份的晶核首次出现",
      "order": 2,
      "selection_condition_zh": "仅用于契约冒烟：fixture_progress = 0.666667",
      "state_id": "state_02"
    },
    {
      "forbidden_zh": [
        "把 Phase 1 fixture 当成完成的科学模拟",
        "让模型改变程序定义的数量、位置或拓扑"
      ],
      "keyframe_id": "keyframe_03",
      "meaning_zh": "已有晶体长大且溶液继续减少",
      "only_major_change_zh": "已有晶体长大且溶液继续减少",
      "order": 3,
      "selection_condition_zh": "仅用于契约冒烟：fixture_progress = 1.000000",
      "state_id": "state_03"
    }
  ],
  "model_policy": {
    "annotations_after_generation": true,
    "image_model_role_zh": "提升玻璃、溶液和湿润晶面材质，晶体数量与区域由程序控制。",
    "video_model_role_zh": "连续表现蒸发、成核与生长，不让晶体跳出或消失。"
  },
  "schema_version": "1.0",
  "semantic_layer_ids": [
    "chem-02_region",
    "chem-02_scalar_field",
    "chem-02_object_identity",
    "chem-02_annotation"
  ],
  "sequence_id": "evaporation_crystallization_phase1_fixture",
  "state_source": "states.jsonl"
}
