{
  "camera": {
    "locked": true,
    "view_zh": "固定教学视图（Phase 1 契约 fixture）"
  },
  "canvas": {
    "coordinate_system": "pixel_xy_top_left",
    "height": 180,
    "width": 320
  },
  "case_id": "BIO-01",
  "fixed_across_sequence_zh": [
    "染色体实例和复制关系",
    "细胞观察镜头",
    "两极方向"
  ],
  "keyframes": [
    {
      "forbidden_zh": [
        "把 Phase 1 fixture 当成完成的科学模拟",
        "让模型改变程序定义的数量、位置或拓扑"
      ],
      "keyframe_id": "keyframe_00",
      "meaning_zh": "染色体凝缩且纺锤体开始形成",
      "only_major_change_zh": "染色体凝缩且纺锤体开始形成",
      "order": 0,
      "selection_condition_zh": "仅用于契约冒烟：fixture_progress = 0.000000",
      "state_id": "state_00"
    },
    {
      "forbidden_zh": [
        "把 Phase 1 fixture 当成完成的科学模拟",
        "让模型改变程序定义的数量、位置或拓扑"
      ],
      "keyframe_id": "keyframe_01",
      "meaning_zh": "复制染色体排列到赤道板",
      "only_major_change_zh": "复制染色体排列到赤道板",
      "order": 1,
      "selection_condition_zh": "仅用于契约冒烟：fixture_progress = 0.333333",
      "state_id": "state_01"
    },
    {
      "forbidden_zh": [
        "把 Phase 1 fixture 当成完成的科学模拟",
        "让模型改变程序定义的数量、位置或拓扑"
      ],
      "keyframe_id": "keyframe_02",
      "meaning_zh": "姐妹染色单体分离并移向两极",
      "only_major_change_zh": "姐妹染色单体分离并移向两极",
      "order": 2,
      "selection_condition_zh": "仅用于契约冒烟：fixture_progress = 0.666667",
      "state_id": "state_02"
    },
    {
      "forbidden_zh": [
        "把 Phase 1 fixture 当成完成的科学模拟",
        "让模型改变程序定义的数量、位置或拓扑"
      ],
      "keyframe_id": "keyframe_03",
      "meaning_zh": "分裂沟收缩并形成两个子细胞",
      "only_major_change_zh": "分裂沟收缩并形成两个子细胞",
      "order": 3,
      "selection_condition_zh": "仅用于契约冒烟：fixture_progress = 1.000000",
      "state_id": "state_03"
    }
  ],
  "model_policy": {
    "annotations_after_generation": true,
    "image_model_role_zh": "提升显微镜、膜、细胞质和染色体材质，不改变实例数量。",
    "video_model_role_zh": "补充染色体运动和膜形变，不吞掉、复制或交换实例。"
  },
  "schema_version": "1.0",
  "semantic_layer_ids": [
    "bio-01_region",
    "bio-01_vector_field",
    "bio-01_object_identity",
    "bio-01_annotation"
  ],
  "sequence_id": "mitosis_phase1_fixture",
  "state_source": "states.jsonl"
}
