{
  "camera": {
    "locked": true,
    "view_zh": "固定教学视图（Phase 1 契约 fixture）"
  },
  "canvas": {
    "coordinate_system": "pixel_xy_top_left",
    "height": 180,
    "width": 320
  },
  "case_id": "GEO-01",
  "fixed_across_sequence_zh": [
    "镜头和远离动态河岸的地貌",
    "主河上下游方向",
    "流量与侵蚀沉积规则"
  ],
  "keyframes": [
    {
      "forbidden_zh": [
        "把 Phase 1 fixture 当成完成的科学模拟",
        "让模型改变程序定义的数量、位置或拓扑"
      ],
      "keyframe_id": "keyframe_00",
      "meaning_zh": "弯曲河道出现外侧侵蚀与内侧沉积",
      "only_major_change_zh": "弯曲河道出现外侧侵蚀与内侧沉积",
      "order": 0,
      "selection_condition_zh": "仅用于契约冒烟：fixture_progress = 0.000000",
      "state_id": "state_00"
    },
    {
      "forbidden_zh": [
        "把 Phase 1 fixture 当成完成的科学模拟",
        "让模型改变程序定义的数量、位置或拓扑"
      ],
      "keyframe_id": "keyframe_01",
      "meaning_zh": "弯道迁移且曲流颈变窄",
      "only_major_change_zh": "弯道迁移且曲流颈变窄",
      "order": 1,
      "selection_condition_zh": "仅用于契约冒烟：fixture_progress = 0.333333",
      "state_id": "state_01"
    },
    {
      "forbidden_zh": [
        "把 Phase 1 fixture 当成完成的科学模拟",
        "让模型改变程序定义的数量、位置或拓扑"
      ],
      "keyframe_id": "keyframe_02",
      "meaning_zh": "主流首次切穿狭颈但旧弯仍相连",
      "only_major_change_zh": "主流首次切穿狭颈但旧弯仍相连",
      "order": 2,
      "selection_condition_zh": "仅用于契约冒烟：fixture_progress = 0.666667",
      "state_id": "state_02"
    },
    {
      "forbidden_zh": [
        "把 Phase 1 fixture 当成完成的科学模拟",
        "让模型改变程序定义的数量、位置或拓扑"
      ],
      "keyframe_id": "keyframe_03",
      "meaning_zh": "旧弯两端封闭并形成牛轭湖",
      "only_major_change_zh": "旧弯两端封闭并形成牛轭湖",
      "order": 3,
      "selection_condition_zh": "仅用于契约冒烟：fixture_progress = 1.000000",
      "state_id": "state_03"
    }
  ],
  "model_policy": {
    "annotations_after_generation": true,
    "image_model_role_zh": "提升河水、土壤、植被和湿地材质，河道拓扑由程序控制。",
    "video_model_role_zh": "只补河岸迁移和切穿过程，不提前封闭或增加支流。"
  },
  "schema_version": "1.0",
  "semantic_layer_ids": [
    "geo-01_hard_boundary",
    "geo-01_region",
    "geo-01_scalar_field",
    "geo-01_vector_field",
    "geo-01_height_or_normal",
    "geo-01_annotation"
  ],
  "sequence_id": "oxbow_lake_formation_phase1_fixture",
  "state_source": "states.jsonl"
}
